[
 {
  "control_id": "GM-GOV-01",
  "family": "GOV",
  "family_name": "Monitoring governance",
  "a84_primary_category": "XC",
  "title": "Monitoring plan and accountable owner",
  "practice_type": "suggested_practice",
  "core": "A post-deployment monitoring plan covering the system exists.",
  "objective": "Each deployed predictive AI system has an approved post-deployment monitoring plan that names an accountable owner and sets the measures, cadence, thresholds, escalation path, and remediation authority, with monitoring intensity tiered by risk.",
  "activity": "Approve the plan before go-live; review it at least annually and after every material model update, threshold breach, or incident.",
  "evidence": "Approved monitoring plan with version history; responsibility (RACI) matrix; review minutes.",
  "cadence": "Before go-live; annually; on material change.",
  "owner_role": "System owner, approved by the AI governance body or equivalent",
  "links_total": 10,
  "links_RMF": 7,
  "links_A84": 1,
  "links_HTI": 2,
  "links_CPG": 0,
  "review_status": "revised",
  "author_response": "Accept with suggested edit"
 },
 {
  "control_id": "GM-GOV-02",
  "family": "GOV",
  "family_name": "Monitoring governance",
  "a84_primary_category": "XC",
  "title": "AI system and model inventory",
  "practice_type": "suggested_practice",
  "core": "Deployed AI systems are recorded in an inventory.",
  "objective": "An inventory lists every deployed predictive AI system with its version, developer, task and output type, deployment sites, data inputs, monitoring plan, and a link to or copy of the current source-attribute record.",
  "activity": "Update the inventory at deployment, update, and retirement; reconcile it against EHR configuration at least quarterly.",
  "evidence": "Inventory export with change log; quarterly reconciliation record.",
  "cadence": "On change; quarterly reconciliation.",
  "owner_role": "AI governance office",
  "links_total": 6,
  "links_RMF": 2,
  "links_A84": 1,
  "links_HTI": 2,
  "links_CPG": 1,
  "review_status": "revised",
  "author_response": "Accept with suggested edit"
 },
 {
  "control_id": "GM-GOV-03",
  "family": "GOV",
  "family_name": "Monitoring governance",
  "a84_primary_category": "XC",
  "title": "Developer monitoring obligations in contracts",
  "practice_type": "suggested_practice",
  "core": "Contracts with the developer require notice of security incidents and vulnerabilities.",
  "objective": "Contracts with the intervention developer require notice, within contract-defined time frames, of model updates, changes to known risks, new validation results, security incidents, and vulnerabilities, and delivery of updated source attributes.",
  "activity": "Include notice clauses and time frames in contracts; track developer notices and confirm source attributes are refreshed after each notice.",
  "evidence": "Contract clauses; developer notice log; source-attribute refresh records.",
  "cadence": "At contracting and renewal; on each developer notice.",
  "owner_role": "Procurement with the system owner",
  "links_total": 14,
  "links_RMF": 4,
  "links_A84": 1,
  "links_HTI": 7,
  "links_CPG": 2,
  "review_status": "revised",
  "author_response": "Accept with suggested edit"
 },
 {
  "control_id": "GM-GOV-04",
  "family": "GOV",
  "family_name": "Monitoring governance",
  "a84_primary_category": "XC",
  "title": "AI incident response integration",
  "practice_type": "suggested_practice",
  "core": "The incident response plan addresses AI-specific incidents.",
  "objective": "Incident response plans cover AI-specific incidents (performance collapse, harmful or biased outputs, misuse, compromise of model or data), with severity criteria, containment steps, internal and external communication, and reporting, and are exercised at least annually.",
  "activity": "Add AI scenarios to the incident response plan and run at least one AI scenario in the annual exercise.",
  "evidence": "Incident response plan with AI annex; exercise after-action report.",
  "cadence": "Annual exercise; plan update after each AI incident.",
  "owner_role": "Incident response lead with the system owner",
  "links_total": 9,
  "links_RMF": 4,
  "links_A84": 1,
  "links_HTI": 0,
  "links_CPG": 4,
  "review_status": "accepted",
  "author_response": "Accept as written"
 },
 {
  "control_id": "GM-GOV-05",
  "family": "GOV",
  "family_name": "Monitoring governance",
  "a84_primary_category": "XC",
  "title": "External sharing of monitoring findings",
  "practice_type": "suggested_practice",
  "core": "A defined policy governs sharing monitoring findings outside the organization.",
  "objective": "Monitoring findings (incidents, drift, bias, security issues, outcome evaluations) are shared with the developer and, under a defined policy and subject to legal and privacy review, with peer deployers and sector bodies such as information sharing and analysis centers or patient safety organizations.",
  "activity": "Apply a sharing policy that sets what is shared, with whom, how fast, and with what de-identification.",
  "evidence": "Sharing policy; log of findings shared and recipients.",
  "cadence": "On each qualifying finding; policy reviewed annually.",
  "owner_role": "AI governance office",
  "links_total": 8,
  "links_RMF": 3,
  "links_A84": 3,
  "links_HTI": 2,
  "links_CPG": 0,
  "review_status": "revised",
  "author_response": "Accept with suggested edit"
 },
 {
  "control_id": "GM-GOV-06",
  "family": "GOV",
  "family_name": "Monitoring governance",
  "a84_primary_category": "XC",
  "title": "Monitoring resources and competence",
  "practice_type": "suggested_practice",
  "core": "Monitoring has a budget, and monitoring staff and users are trained for the system.",
  "objective": "Monitoring has budgeted resources (outcome labels, compute, reviewer and clinician time, tooling), trained staff, and users trained on the intervention's intended use and limits.",
  "activity": "Set the monitoring budget in the plan; train monitoring staff and users before access and when the intervention changes.",
  "evidence": "Budget line; training records; staffing assignments.",
  "cadence": "Annual budget; training at onboarding and on change.",
  "owner_role": "System owner",
  "links_total": 7,
  "links_RMF": 3,
  "links_A84": 4,
  "links_HTI": 0,
  "links_CPG": 0,
  "review_status": "accepted",
  "author_response": "Accept as written"
 },
 {
  "control_id": "GM-GOV-07",
  "family": "GOV",
  "family_name": "Monitoring governance",
  "a84_primary_category": "XC",
  "title": "Independent assessment of monitoring",
  "practice_type": "suggested_practice",
  "core": "Someone independent of the build/operate team periodically assesses the monitoring.",
  "objective": "An assessor independent of the team that built or operates the system periodically reviews monitoring design, metrics, thresholds, and results, and findings are tracked to closure.",
  "activity": "Schedule independent review by risk tier (for example, annually for high-risk systems); track findings in a risk register.",
  "evidence": "Independent review report; findings tracker.",
  "cadence": "By risk tier; at least every two years.",
  "owner_role": "Internal audit or external assessor",
  "links_total": 5,
  "links_RMF": 4,
  "links_A84": 1,
  "links_HTI": 0,
  "links_CPG": 0,
  "review_status": "accepted",
  "author_response": "Accept as written"
 },
 {
  "control_id": "GM-FUN-01",
  "family": "FUN",
  "family_name": "Functionality monitoring",
  "a84_primary_category": "FUN",
  "title": "Performance baseline and deviation thresholds",
  "practice_type": "suggested_practice",
  "core": "A pre-deployment local baseline with deviation thresholds is recorded.",
  "objective": "Before go-live, the organization records the baseline the system will be monitored against (validity metrics with uncertainty from the developer's internal and external validation results and, where feasible, from a local silent trial) and sets deviation thresholds that trigger review, correction, or deactivation.",
  "activity": "Run a local silent (shadow) trial where feasible; record baseline metrics and confidence intervals; set thresholds in the monitoring plan.",
  "evidence": "Baseline report; threshold table in the monitoring plan.",
  "cadence": "Before go-live; after every model update.",
  "owner_role": "Clinical or business owner with the data science lead",
  "links_total": 12,
  "links_RMF": 6,
  "links_A84": 2,
  "links_HTI": 4,
  "links_CPG": 0,
  "review_status": "revised",
  "author_response": "Accept with suggested edits"
 },
 {
  "control_id": "GM-FUN-02",
  "family": "FUN",
  "family_name": "Functionality monitoring",
  "a84_primary_category": "FUN",
  "title": "Local validity monitoring",
  "practice_type": "suggested_practice",
  "core": "Validity is measured in the deploying organization's own data.",
  "objective": "The intervention's validity in local data (for example discrimination, calibration, and positive predictive value at the operating threshold) is measured with confidence intervals at the planned cadence and compared with the baseline and thresholds.",
  "activity": "Compute validity metrics on each monitoring window; flag threshold breaches to the owner.",
  "evidence": "Monitoring dashboard extracts; threshold breach log.",
  "cadence": "As set in the plan (for example monthly or quarterly), plus event-driven.",
  "owner_role": "Data science lead",
  "links_total": 9,
  "links_RMF": 5,
  "links_A84": 2,
  "links_HTI": 2,
  "links_CPG": 0,
  "review_status": "accepted",
  "author_response": "Accept as written"
 },
 {
  "control_id": "GM-FUN-03",
  "family": "FUN",
  "family_name": "Functionality monitoring",
  "a84_primary_category": "FUN",
  "title": "Input data and population drift detection",
  "practice_type": "suggested_practice",
  "core": "Input data and population mix are compared against a reference distribution.",